{
  "$schema": "http://json-schema.org/draft-07/schema#",
  "$id": "https://clawrocket.dev/contracts/editorial-room/v0/optimization_config.schema.json",
  "title": "OptimizationConfig",
  "description": "Configuration for an optimization round. See EDITORIAL_ROOM_CONTRACT.md §6.6.1.",
  "type": "object",
  "additionalProperties": false,
  "definitions": {
    "OptimizationGates": {
      "type": "object",
      "additionalProperties": false,
      "required": [
        "rubric_min",
        "ssr_likelihood_min",
        "diversity_min",
        "slop_penalty_max",
        "ssr_value_min"
      ],
      "properties": {
        "rubric_min": {
          "type": "object",
          "additionalProperties": { "type": "number" },
          "description": "Per-axis hard gate; e.g., { specificity: 3, disputability: 3 }."
        },
        "ssr_likelihood_min": {
          "type": "number",
          "description": "Per-primary-persona hard gate; default 3.5 for Topics."
        },
        "diversity_min": {
          "type": "number",
          "description": "Cosine distance from acceptable pool; default 0.4."
        },
        "slop_penalty_max": {
          "type": "number",
          "description": "Max acceptable slop_penalty for Drafts; default 5.0."
        },
        "ssr_value_min": {
          "anyOf": [{ "type": "null" }, { "type": "number" }],
          "description": "Per-primary-persona; null for Theme/Topic."
        }
      }
    },
    "ObjectiveWeights": {
      "type": "object",
      "additionalProperties": false,
      "required": [
        "ssr_likelihood_mean",
        "ssr_value_mean",
        "rubric_composite_mean",
        "cohort_coverage",
        "cohort_underservice_penalty",
        "novelty_bonus"
      ],
      "properties": {
        "ssr_likelihood_mean": { "type": "number", "description": "Typically 0.35." },
        "ssr_value_mean": { "type": "number", "description": "Typically 0.20." },
        "rubric_composite_mean": { "type": "number", "description": "Typically 0.30." },
        "cohort_coverage": { "type": "number", "description": "Typically 0.05." },
        "cohort_underservice_penalty": {
          "type": "number",
          "description": "Typically -0.05 (negative)."
        },
        "novelty_bonus": { "type": "number", "description": "Typically 0.15." }
      }
    }
  },
  "required": [
    "schema_version",
    "persona_slugs",
    "n_candidates_per_iter",
    "n_iterations",
    "n_winners_carried",
    "n_ssr_samples",
    "top_k_returned",
    "diversity_strategy",
    "diversity_min_distance",
    "cohort_targeted_subloops",
    "contrast_mutation_fraction",
    "gates",
    "objective_weights",
    "budget_usd",
    "wallclock_cap_ms",
    "convergence_min_iters_for_signal",
    "convergence_delta_threshold",
    "context",
    "voice_slug",
    "scoring_pipeline_slug"
  ],
  "properties": {
    "schema_version": { "const": "0" },
    "persona_slugs": {
      "type": "array",
      "items": { "type": "string", "minLength": 1 },
      "description": "Primary personas. Defaults to SetupState.audience_persona_slugs for the parent Piece; explicit override here is recorded in OptimizationRound.config but does NOT mutate SetupState."
    },
    "n_candidates_per_iter": { "type": "integer", "minimum": 1 },
    "n_iterations": { "type": "integer", "minimum": 1 },
    "n_winners_carried": {
      "type": "integer",
      "minimum": 0,
      "description": "Top-K winners that survive into iter 2+ (typically 5)."
    },
    "n_ssr_samples": {
      "type": "integer",
      "minimum": 1,
      "description": "SSR samples per (persona, candidate); default 8."
    },
    "top_k_returned": { "type": "integer", "minimum": 1 },
    "diversity_strategy": {
      "type": "string",
      "enum": ["minimal", "default", "aggressive"]
    },
    "diversity_min_distance": {
      "type": "number",
      "minimum": 0,
      "description": "Cosine distance threshold; default 0.4."
    },
    "cohort_targeted_subloops": {
      "type": "boolean",
      "description": "Run separate sub-loop per persona cohort."
    },
    "contrast_mutation_fraction": {
      "type": "number",
      "minimum": 0,
      "maximum": 1,
      "description": "Fraction of mutations using explicit-contrast prompts (default 0.4)."
    },
    "gates": { "$ref": "#/definitions/OptimizationGates" },
    "objective_weights": { "$ref": "#/definitions/ObjectiveWeights" },
    "budget_usd": {
      "type": "number",
      "minimum": 0,
      "description": "Hard cap; round aborts if projected > budget."
    },
    "wallclock_cap_ms": {
      "anyOf": [{ "type": "null" }, { "type": "number", "minimum": 0 }],
      "description": "Optional; null = no wallclock cap."
    },
    "convergence_min_iters_for_signal": {
      "type": "integer",
      "minimum": 1,
      "description": "Default 2."
    },
    "convergence_delta_threshold": {
      "type": "number",
      "description": "Default 0.05; min improvement to keep iterating."
    },
    "context": {
      "anyOf": [
        { "type": "null" },
        { "$ref": "https://clawrocket.dev/contracts/editorial-room/v0/skill_context.schema.json" }
      ],
      "description": "For Theme/Topic; null otherwise."
    },
    "voice_slug": {
      "type": "string",
      "minLength": 1,
      "description": "Resolved from setup_state when piece_id is set; explicit when piece_id is null (e.g., for Theme search)."
    },
    "scoring_pipeline_slug": { "type": "string", "minLength": 1 }
  }
}
