{
  "schema_version": "0",
  "persona_slugs": [
    "persona/ankit-indie-dev",
    "persona/ravi-studio-lead",
    "persona/mei-publisher"
  ],
  "n_candidates_per_iter": 12,
  "n_iterations": 5,
  "n_winners_carried": 5,
  "n_ssr_samples": 12,
  "top_k_returned": 3,
  "diversity_strategy": "aggressive",
  "diversity_min_distance": 0.5,
  "cohort_targeted_subloops": true,
  "contrast_mutation_fraction": 0.5,
  "gates": {
    "rubric_min": {
      "specificity": 3,
      "disputability": 3,
      "voice": 3
    },
    "ssr_likelihood_min": 3.5,
    "diversity_min": 0.5,
    "slop_penalty_max": 4.0,
    "ssr_value_min": 3.0
  },
  "objective_weights": {
    "ssr_likelihood_mean": 0.3,
    "ssr_value_mean": 0.25,
    "rubric_composite_mean": 0.25,
    "cohort_coverage": 0.05,
    "cohort_underservice_penalty": -0.05,
    "novelty_bonus": 0.2
  },
  "budget_usd": 50.0,
  "wallclock_cap_ms": 600000,
  "convergence_min_iters_for_signal": 3,
  "convergence_delta_threshold": 0.05,
  "context": null,
  "voice_slug": "voice/gamemakers-2026",
  "scoring_pipeline_slug": "scoring_pipeline/gamemakers_default"
}
